<?xml version="1.0" encoding="UTF-8"?>
<!-- ***************************************************************** -->
<!--                                                                   -->
<!-- Licensed Materials - Property of IBM                              -->
<!--                                                                   -->
<!-- IBM SPSS Products: Statistics Common                              -->
<!--                                                                   -->
<!-- (C) Copyright IBM Corp. 1989, 2011                                -->
<!--                                                                   -->
<!-- US Government Users Restricted Rights - Use, duplication or       -->
<!-- disclosure restricted by GSA ADP Schedule Contract with IBM       -->
<!-- Corp.                                                             -->
<!--                                                                   -->
<!-- ***************************************************************** -->

 <!-- Created 5/22/08 -->
<Command xmlns="http://xml.spss.com/spss/extension"
    xmlns:xsi="http://www.w3.org/2001/XMLSchema-instance"
    xsi:schemaLocation="http://xml.spss.com/spss/extension http://xml.spss.com/spss/extension/SyntaxSchema.xsd"
    Name="VARCOMP" EndRequired="None" IsArbitrary="No" Language="Syntax">
    <Subcommand Name="GLOBAL_PARAMS" EqualsSign="None">
        <Parameter Name="BY" EqualsSign="None" ParameterType="Keyword"/>
        <Parameter Name="WITH" EqualsSign="None" ParameterType="Keyword"/>
    </Subcommand>
    <Subcommand Name="RANDOM" EqualsSign="Optional"/>
    <Subcommand Name="METHOD" EqualsSign="Optional">
        <Parameter Name="MINQUE" EqualsSign="None" ParameterType="Keyword"/>
        <Parameter Name="ML" EqualsSign="None" ParameterType="Keyword"/>
        <Parameter Name="REML" EqualsSign="None" ParameterType="Keyword"/>
        <Parameter Name="SSTYPE" EqualsSign="None" ParameterType="Keyword"/>
    </Subcommand>
    <Subcommand Name="INTERCEPT" EqualsSign="Optional">
        <Parameter Name="INCLUDE" EqualsSign="None" ParameterType="Keyword"/>
        <Parameter Name="EXCLUDE" EqualsSign="None" ParameterType="Keyword"/>
    </Subcommand>
    <Subcommand Name="MISSING" EqualsSign="Optional">
        <Parameter Name="INCLUDE" EqualsSign="None" ParameterType="Keyword"/>
        <Parameter Name="EXCLUDE" EqualsSign="None" ParameterType="Keyword"/>
    </Subcommand>
    <Subcommand Name="REGWGT" EqualsSign="Optional"/>
    <Subcommand Name="CRITERIA" EqualsSign="Optional">
        <Parameter Name="CONVERGE" EqualsSign="None" ParameterType="Keyword"/>
        <Parameter Name="EPS" EqualsSign="None" ParameterType="Keyword"/>
        <Parameter Name="ITERATE" EqualsSign="None" ParameterType="Keyword"/>
    </Subcommand>
    <Subcommand Name="PRINT" EqualsSign="Optional">
        <Parameter Name="EMS" EqualsSign="None" ParameterType="Keyword"/>
        <Parameter Name="HISTORY" EqualsSign="None" ParameterType="Keyword"/>
        <Parameter Name="SS" EqualsSign="None" ParameterType="Keyword"/>
    </Subcommand>
    <Subcommand Name="OUTFILE" EqualsSign="Optional">
        <Parameter Name="VAREST" EqualsSign="None" ParameterType="Keyword"/>
        <Parameter Name="COVB" EqualsSign="None" ParameterType="Keyword"/>
        <Parameter Name="CORB" EqualsSign="None" ParameterType="Keyword"/>
    </Subcommand>
    <Subcommand Name="DESIGN" EqualsSign="Optional">
        <Parameter Name="INTERCEPT" EqualsSign="None" ParameterType="Keyword"/>
    </Subcommand>
</Command>
