<?xml version="1.0" encoding="UTF-8"?>
<!-- ***************************************************************** -->
<!--                                                                   -->
<!-- Licensed Materials - Property of IBM                              -->
<!--                                                                   -->
<!-- IBM SPSS Products: Statistics Common                              -->
<!--                                                                   -->
<!-- (C) Copyright IBM Corp. 1989, 2011                                -->
<!--                                                                   -->
<!-- US Government Users Restricted Rights - Use, duplication or       -->
<!-- disclosure restricted by GSA ADP Schedule Contract with IBM       -->
<!-- Corp.                                                             -->
<!--                                                                   -->
<!-- ***************************************************************** -->


<Command xmlns="http://xml.spss.com/spss/extension"
    xmlns:xsi="http://www.w3.org/2001/XMLSchema-instance"
    xsi:schemaLocation="http://xml.spss.com/spss/extension file:/C:/temp/schema/SyntaxSchema.xsd"
    Name="HILOGLINEAR" EndRequired="None" IsArbitrary="No" Language="Syntax">
    <Subcommand Name="GLOBAL_PARAMS">
        <Parameter Name="ALL" EqualsSign="None" ParameterType="Keyword"/>
    </Subcommand>
    <Subcommand Name="METHOD" EqualsSign="Optional">
        <Parameter Name="BACKWARD" EqualsSign="None" ParameterType="Keyword"/>
    </Subcommand>
    <Subcommand Name="MAXORDER" EqualsSign="Optional"/>
    <Subcommand Name="CRITERIA" EqualsSign="Optional">
        <Parameter Name="CONVERGE" EqualsSign="None" ParameterType="Keyword"/>
        <Parameter Name="ITERATE" EqualsSign="None" ParameterType="Keyword"/>
        <Parameter Name="P" EqualsSign="None" ParameterType="Keyword"/>
        <Parameter Name="DELTA" EqualsSign="None" ParameterType="Keyword"/>
        <Parameter Name="MAXSTEPS" EqualsSign="None" ParameterType="Keyword"/>
        <Parameter Name="DEFAULT" EqualsSign="None" ParameterType="Keyword"/>
    </Subcommand>
    <Subcommand Name="CWEIGHT" EqualsSign="Optional"/>
    <Subcommand Name="PRINT" EqualsSign="Optional">
        <Parameter Name="FREQ" EqualsSign="None" ParameterType="Keyword"/>
        <Parameter Name="RESID" EqualsSign="None" ParameterType="Keyword"/>
        <Parameter Name="ESTIM" EqualsSign="None" ParameterType="Keyword"/>
        <Parameter Name="ASSOCIATION" EqualsSign="None" ParameterType="Keyword"/>
        <Parameter Name="DEFAULT" EqualsSign="None" ParameterType="Keyword"/>
        <Parameter Name="ALL" EqualsSign="None" ParameterType="Keyword"/>
        <Parameter Name="NONE" EqualsSign="None" ParameterType="Keyword"/>
    </Subcommand>
    <Subcommand Name="PLOT" EqualsSign="Optional">
        <Parameter Name="NONE" EqualsSign="None" ParameterType="Keyword"/>
        <Parameter Name="DEFAULT" EqualsSign="None" ParameterType="Keyword"/>
        <Parameter Name="RESID" EqualsSign="None" ParameterType="Keyword"/>
        <Parameter Name="NORMPROB" EqualsSign="None" ParameterType="Keyword"/>
        <Parameter Name="ALL" EqualsSign="None" ParameterType="Keyword"/>
    </Subcommand>
    <Subcommand Name="MISSING" EqualsSign="Optional">
        <Parameter Name="EXCLUDE" EqualsSign="None" ParameterType="Keyword"/>
        <Parameter Name="INCLUDE" EqualsSign="None" ParameterType="Keyword"/>
    </Subcommand>
    <Subcommand Name="DESIGN" EqualsSign="Optional"/>
</Command>
