<?xml version="1.0" encoding="UTF-8"?>
<!-- ***************************************************************** -->
<!--                                                                   -->
<!-- Licensed Materials - Property of IBM                              -->
<!--                                                                   -->
<!-- IBM SPSS Products: Statistics Common                              -->
<!--                                                                   -->
<!-- (C) Copyright IBM Corp. 1989, 2011                                -->
<!--                                                                   -->
<!-- US Government Users Restricted Rights - Use, duplication or       -->
<!-- disclosure restricted by GSA ADP Schedule Contract with IBM       -->
<!-- Corp.                                                             -->
<!--                                                                   -->
<!-- ***************************************************************** -->

 <!-- Created 5/12/08 -->
<Command xmlns="http://xml.spss.com/spss/extension"
    xmlns:xsi="http://www.w3.org/2001/XMLSchema-instance"
    xsi:schemaLocation="http://xml.spss.com/spss/extension file:/C:/temp/schema/SyntaxSchema.xsd"
    Name="MATCH FILES" EndRequired="None" IsArbitrary="No" Language="Syntax">
    <Subcommand Name="GLOBAL_PARAMS">
        <Parameter Name="FILE" EqualsSign="Optional" ParameterType="Keyword"/>
        <Parameter Name="TABLE" EqualsSign="Optional" ParameterType="Keyword"/>
    </Subcommand>
    <Subcommand Name="FILE" EqualsSign="Optional"/>
    <Subcommand Name="TABLE" EqualsSign="Optional"/>
    <Subcommand Name="RENAME" EqualsSign="Optional"/>
    <Subcommand Name="IN" EqualsSign="Optional"/>
    <Subcommand Name="FILE" EqualsSign="Optional">
        <Parameter Name="TABLE" EqualsSign="Optional" ParameterType="Keyword"/>
    </Subcommand>
    <Subcommand Name="BY" EqualsSign="None"/>
    <Subcommand Name="MAP" EqualsSign="None"/>
    <Subcommand Name="KEEP" EqualsSign="Optional">
        <Parameter Name="ALL" EqualsSign="None" ParameterType="Keyword"/>
    </Subcommand>
    <Subcommand Name="DROP" EqualsSign="Optional"/>
    <Subcommand Name="FIRST" EqualsSign="Optional"/>
    <Subcommand Name="LAST" EqualsSign="Optional"/>
</Command>
